{"experiment_id": 1, "timestamp": "2026-03-14T01:23:46Z", "commit": "9f603b0", "hypothesis": "baseline", "category": "baseline", "change_summary": "baseline run \u2014 no changes", "files_changed": [], "metric_name": "val_gini", "metric_value": 0.124007, "metric_direction": "maximize", "secondary_metrics": {"training_seconds": 60.0, "total_seconds": 60.2, "peak_memory_mb": 498.2, "num_steps": 22368.0, "num_params": 96257.0, "device": "mps", "device_name": "Apple M2"}, "status": "keep", "reasoning": "", "parent_experiment": 0, "platform_device": "mps", "platform_name": "Apple M2"}
{"experiment_id": 2, "timestamp": "2026-03-14T01:24:51Z", "commit": "31bb1b6", "hypothesis": "LEARNING_RATE = 0.0003 (was 0.001)", "category": "hyperparameter", "change_summary": "Sweep LEARNING_RATE: testing 0.0003 against current 0.001", "files_changed": ["train.py"], "metric_name": "val_gini", "metric_value": 0.129195, "metric_direction": "maximize", "secondary_metrics": {"training_seconds": 60.3, "total_seconds": 60.5, "peak_memory_mb": 498.2, "num_steps": 23533.0, "num_params": 96257.0, "device": "mps", "device_name": "Apple M2"}, "status": "keep", "reasoning": "", "parent_experiment": 0, "platform_device": "mps", "platform_name": "Apple M2"}
{"experiment_id": 3, "timestamp": "2026-03-14T01:25:55Z", "commit": "f025f2c", "hypothesis": "LEARNING_RATE = 0.001 (was 0.0003)", "category": "hyperparameter", "change_summary": "Sweep LEARNING_RATE: testing 0.001 against current 0.0003", "files_changed": ["train.py"], "metric_name": "val_gini", "metric_value": 0.128953, "metric_direction": "maximize", "secondary_metrics": {"training_seconds": 60.0, "total_seconds": 60.3, "peak_memory_mb": 498.2, "num_steps": 17941.0, "num_params": 96257.0, "device": "mps", "device_name": "Apple M2"}, "status": "discard", "reasoning": "", "parent_experiment": 0, "platform_device": "mps", "platform_name": "Apple M2"}
{"experiment_id": 4, "timestamp": "2026-03-14T01:27:01Z", "commit": "050c9af", "hypothesis": "LEARNING_RATE = 0.003 (was 0.0003)", "category": "hyperparameter", "change_summary": "Sweep LEARNING_RATE: testing 0.003 against current 0.0003", "files_changed": ["train.py"], "metric_name": "val_gini", "metric_value": 0.18128, "metric_direction": "maximize", "secondary_metrics": {"training_seconds": 60.3, "total_seconds": 60.5, "peak_memory_mb": 498.2, "num_steps": 22135.0, "num_params": 96257.0, "device": "mps", "device_name": "Apple M2"}, "status": "keep", "reasoning": "", "parent_experiment": 0, "platform_device": "mps", "platform_name": "Apple M2"}
{"experiment_id": 5, "timestamp": "2026-03-14T01:28:06Z", "commit": "890df35", "hypothesis": "LEARNING_RATE = 0.01 (was 0.003)", "category": "hyperparameter", "change_summary": "Sweep LEARNING_RATE: testing 0.01 against current 0.003", "files_changed": ["train.py"], "metric_name": "val_gini", "metric_value": 0.249911, "metric_direction": "maximize", "secondary_metrics": {"training_seconds": 60.8, "total_seconds": 60.9, "peak_memory_mb": 498.2, "num_steps": 17242.0, "num_params": 96257.0, "device": "mps", "device_name": "Apple M2"}, "status": "keep", "reasoning": "", "parent_experiment": 0, "platform_device": "mps", "platform_name": "Apple M2"}
{"experiment_id": 6, "timestamp": "2026-03-14T01:29:29Z", "commit": "683977c", "hypothesis": "BATCH_SIZE = 64 (was 2048)", "category": "hyperparameter", "change_summary": "Sweep BATCH_SIZE: testing 64 against current 2048", "files_changed": ["train.py"], "metric_name": "val_gini", "metric_value": -0.345785, "metric_direction": "maximize", "secondary_metrics": {"training_seconds": 77.8, "total_seconds": 78.5, "peak_memory_mb": 493.3, "num_steps": 29764.0, "num_params": 96257.0, "device": "mps", "device_name": "Apple M2"}, "status": "discard", "reasoning": "", "parent_experiment": 0, "platform_device": "mps", "platform_name": "Apple M2"}
{"experiment_id": 7, "timestamp": "2026-03-14T01:30:41Z", "commit": "6aeb411", "hypothesis": "BATCH_SIZE = 128 (was 2048)", "category": "hyperparameter", "change_summary": "Sweep BATCH_SIZE: testing 128 against current 2048", "files_changed": ["train.py"], "metric_name": "val_gini", "metric_value": -0.339719, "metric_direction": "maximize", "secondary_metrics": {"training_seconds": 68.3, "total_seconds": 68.4, "peak_memory_mb": 493.4, "num_steps": 26047.0, "num_params": 96257.0, "device": "mps", "device_name": "Apple M2"}, "status": "discard", "reasoning": "", "parent_experiment": 0, "platform_device": "mps", "platform_name": "Apple M2"}
{"experiment_id": 8, "timestamp": "2026-03-14T01:31:46Z", "commit": "4cac527", "hypothesis": "BATCH_SIZE = 256 (was 2048)", "category": "hyperparameter", "change_summary": "Sweep BATCH_SIZE: testing 256 against current 2048", "files_changed": ["train.py"], "metric_name": "val_gini", "metric_value": 0.167529, "metric_direction": "maximize", "secondary_metrics": {"training_seconds": 60.8, "total_seconds": 60.9, "peak_memory_mb": 493.5, "num_steps": 24193.0, "num_params": 96257.0, "device": "mps", "device_name": "Apple M2"}, "status": "discard", "reasoning": "", "parent_experiment": 0, "platform_device": "mps", "platform_name": "Apple M2"}
{"experiment_id": 9, "timestamp": "2026-03-14T01:32:51Z", "commit": "399a6bd", "hypothesis": "BATCH_SIZE = 512 (was 2048)", "category": "hyperparameter", "change_summary": "Sweep BATCH_SIZE: testing 512 against current 2048", "files_changed": ["train.py"], "metric_name": "val_gini", "metric_value": 0.252253, "metric_direction": "maximize", "secondary_metrics": {"training_seconds": 61.0, "total_seconds": 61.2, "peak_memory_mb": 494.1, "num_steps": 24206.0, "num_params": 96257.0, "device": "mps", "device_name": "Apple M2"}, "status": "keep", "reasoning": "", "parent_experiment": 0, "platform_device": "mps", "platform_name": "Apple M2"}
{"experiment_id": 10, "timestamp": "2026-03-14T01:33:56Z", "commit": "3b0220b", "hypothesis": "DROPOUT = 0.0 (was 0.15)", "category": "hyperparameter", "change_summary": "Sweep DROPOUT: testing 0.0 against current 0.15", "files_changed": ["train.py"], "metric_name": "val_gini", "metric_value": 0.258265, "metric_direction": "maximize", "secondary_metrics": {"training_seconds": 61.2, "total_seconds": 61.3, "peak_memory_mb": 494.0, "num_steps": 31654.0, "num_params": 96257.0, "device": "mps", "device_name": "Apple M2"}, "status": "keep", "reasoning": "", "parent_experiment": 0, "platform_device": "mps", "platform_name": "Apple M2"}
{"experiment_id": 11, "timestamp": "2026-03-14T01:38:11Z", "commit": "ccafea0", "hypothesis": "LEARNING_RATE = 0.0003 (was 0.01)", "category": "hyperparameter", "change_summary": "Sweep LEARNING_RATE: testing 0.0003 against current 0.01", "files_changed": ["train.py"], "metric_name": "val_gini", "metric_value": 0.089323, "metric_direction": "maximize", "secondary_metrics": {"training_seconds": 60.9, "total_seconds": 61.2, "peak_memory_mb": 494.0, "num_steps": 31654.0, "num_params": 96257.0, "device": "mps", "device_name": "Apple M2"}, "status": "discard", "reasoning": "", "parent_experiment": 0, "platform_device": "mps", "platform_name": "Apple M2"}
{"experiment_id": 12, "timestamp": "2026-03-14T01:39:16Z", "commit": "3fd16c4", "hypothesis": "LEARNING_RATE = 0.001 (was 0.01)", "category": "hyperparameter", "change_summary": "Sweep LEARNING_RATE: testing 0.001 against current 0.01", "files_changed": ["train.py"], "metric_name": "val_gini", "metric_value": 0.133683, "metric_direction": "maximize", "secondary_metrics": {"training_seconds": 61.9, "total_seconds": 62.0, "peak_memory_mb": 494.0, "num_steps": 30723.0, "num_params": 96257.0, "device": "mps", "device_name": "Apple M2"}, "status": "discard", "reasoning": "", "parent_experiment": 0, "platform_device": "mps", "platform_name": "Apple M2"}
{"experiment_id": 13, "timestamp": "2026-03-14T01:40:21Z", "commit": "3452c10", "hypothesis": "LEARNING_RATE = 0.003 (was 0.01)", "category": "hyperparameter", "change_summary": "Sweep LEARNING_RATE: testing 0.003 against current 0.01", "files_changed": ["train.py"], "metric_name": "val_gini", "metric_value": 0.222492, "metric_direction": "maximize", "secondary_metrics": {"training_seconds": 61.8, "total_seconds": 62.0, "peak_memory_mb": 494.0, "num_steps": 30723.0, "num_params": 96257.0, "device": "mps", "device_name": "Apple M2"}, "status": "discard", "reasoning": "", "parent_experiment": 0, "platform_device": "mps", "platform_name": "Apple M2"}
{"experiment_id": 14, "timestamp": "2026-03-14T01:41:33Z", "commit": "1674410", "hypothesis": "BATCH_SIZE = 64 (was 512)", "category": "hyperparameter", "change_summary": "Sweep BATCH_SIZE: testing 64 against current 512", "files_changed": ["train.py"], "metric_name": "val_gini", "metric_value": 0.234153, "metric_direction": "maximize", "secondary_metrics": {"training_seconds": 67.9, "total_seconds": 68.3, "peak_memory_mb": 493.6, "num_steps": 37205.0, "num_params": 96257.0, "device": "mps", "device_name": "Apple M2"}, "status": "discard", "reasoning": "", "parent_experiment": 0, "platform_device": "mps", "platform_name": "Apple M2"}
{"experiment_id": 15, "timestamp": "2026-03-14T01:42:38Z", "commit": "56afaa0", "hypothesis": "BATCH_SIZE = 128 (was 512)", "category": "hyperparameter", "change_summary": "Sweep BATCH_SIZE: testing 128 against current 512", "files_changed": ["train.py"], "metric_name": "val_gini", "metric_value": 0.248656, "metric_direction": "maximize", "secondary_metrics": {"training_seconds": 61.7, "total_seconds": 61.8, "peak_memory_mb": 493.5, "num_steps": 33489.0, "num_params": 96257.0, "device": "mps", "device_name": "Apple M2"}, "status": "discard", "reasoning": "", "parent_experiment": 0, "platform_device": "mps", "platform_name": "Apple M2"}
{"experiment_id": 16, "timestamp": "2026-03-14T01:48:21Z", "commit": "d3f7e3e", "hypothesis": "DROPOUT = 0.05 (was 0.0)", "category": "hyperparameter", "change_summary": "Sweep DROPOUT: testing 0.05 against current 0.0", "files_changed": ["train.py"], "metric_name": "val_gini", "metric_value": 0.254641, "metric_direction": "maximize", "secondary_metrics": {"training_seconds": 61.8, "total_seconds": 61.9, "peak_memory_mb": 494.1, "num_steps": 28861.0, "num_params": 96257.0, "device": "mps", "device_name": "Apple M2"}, "status": "discard", "reasoning": "", "parent_experiment": 0, "platform_device": "mps", "platform_name": "Apple M2", "mutation_key": "param:DROPOUT=0.05"}
{"experiment_id": 17, "timestamp": "2026-03-14T01:49:24Z", "commit": "8585a48", "hypothesis": "DROPOUT = 0.1 (was 0.0)", "category": "hyperparameter", "change_summary": "Sweep DROPOUT: testing 0.1 against current 0.0", "files_changed": ["train.py"], "metric_name": "val_gini", "metric_value": 0.257311, "metric_direction": "maximize", "secondary_metrics": {"training_seconds": 60.4, "total_seconds": 60.8, "peak_memory_mb": 494.1, "num_steps": 27930.0, "num_params": 96257.0, "device": "mps", "device_name": "Apple M2"}, "status": "discard", "reasoning": "", "parent_experiment": 0, "platform_device": "mps", "platform_name": "Apple M2", "mutation_key": "param:DROPOUT=0.1"}
{"experiment_id": 18, "timestamp": "2026-03-14T01:50:29Z", "commit": "86b666b", "hypothesis": "DROPOUT = 0.2 (was 0.0)", "category": "hyperparameter", "change_summary": "Sweep DROPOUT: testing 0.2 against current 0.0", "files_changed": ["train.py"], "metric_name": "val_gini", "metric_value": 0.243482, "metric_direction": "maximize", "secondary_metrics": {"training_seconds": 61.5, "total_seconds": 61.7, "peak_memory_mb": 494.1, "num_steps": 27930.0, "num_params": 96257.0, "device": "mps", "device_name": "Apple M2"}, "status": "discard", "reasoning": "", "parent_experiment": 0, "platform_device": "mps", "platform_name": "Apple M2", "mutation_key": "param:DROPOUT=0.2"}
{"experiment_id": 19, "timestamp": "2026-03-14T01:51:34Z", "commit": "b1ff655", "hypothesis": "DROPOUT = 0.3 (was 0.0)", "category": "hyperparameter", "change_summary": "Sweep DROPOUT: testing 0.3 against current 0.0", "files_changed": ["train.py"], "metric_name": "val_gini", "metric_value": 0.32103, "metric_direction": "maximize", "secondary_metrics": {"training_seconds": 61.4, "total_seconds": 61.7, "peak_memory_mb": 494.1, "num_steps": 24206.0, "num_params": 96257.0, "device": "mps", "device_name": "Apple M2"}, "status": "keep", "reasoning": "", "parent_experiment": 0, "platform_device": "mps", "platform_name": "Apple M2", "mutation_key": "param:DROPOUT=0.3"}
{"experiment_id": 20, "timestamp": "2026-03-14T01:52:39Z", "commit": "62d383e", "hypothesis": "WEIGHT_DECAY = 0 (was 0.0001)", "category": "hyperparameter", "change_summary": "Sweep WEIGHT_DECAY: testing 0 against current 0.0001", "files_changed": ["train.py"], "metric_name": "val_gini", "metric_value": -0.345785, "metric_direction": "maximize", "secondary_metrics": {"training_seconds": 61.0, "total_seconds": 61.1, "peak_memory_mb": 494.1, "num_steps": 28861.0, "num_params": 96257.0, "device": "mps", "device_name": "Apple M2"}, "status": "discard", "reasoning": "", "parent_experiment": 0, "platform_device": "mps", "platform_name": "Apple M2", "mutation_key": "param:WEIGHT_DECAY=0"}
{"experiment_id": 21, "timestamp": "2026-03-14T01:53:44Z", "commit": "5ab13b8", "hypothesis": "WEIGHT_DECAY = 1e-05 (was 0.0001)", "category": "hyperparameter", "change_summary": "Sweep WEIGHT_DECAY: testing 1e-05 against current 0.0001", "files_changed": ["train.py"], "metric_name": "val_gini", "metric_value": -0.345785, "metric_direction": "maximize", "secondary_metrics": {"training_seconds": 61.1, "total_seconds": 61.6, "peak_memory_mb": 494.1, "num_steps": 27930.0, "num_params": 96257.0, "device": "mps", "device_name": "Apple M2"}, "status": "discard", "reasoning": "", "parent_experiment": 0, "platform_device": "mps", "platform_name": "Apple M2", "mutation_key": "param:WEIGHT_DECAY=1e-05"}
{"experiment_id": 22, "timestamp": "2026-03-14T01:54:49Z", "commit": "824c5f7", "hypothesis": "WEIGHT_DECAY = 0.001 (was 0.0001)", "category": "hyperparameter", "change_summary": "Sweep WEIGHT_DECAY: testing 0.001 against current 0.0001", "files_changed": ["train.py"], "metric_name": "val_gini", "metric_value": 0.223143, "metric_direction": "maximize", "secondary_metrics": {"training_seconds": 61.5, "total_seconds": 61.6, "peak_memory_mb": 494.1, "num_steps": 26999.0, "num_params": 96257.0, "device": "mps", "device_name": "Apple M2"}, "status": "discard", "reasoning": "", "parent_experiment": 0, "platform_device": "mps", "platform_name": "Apple M2", "mutation_key": "param:WEIGHT_DECAY=0.001"}
{"experiment_id": 23, "timestamp": "2026-03-14T01:55:54Z", "commit": "68f5435", "hypothesis": "HIDDEN_DIMS = [64, 32] (was [256, 128, 64])", "category": "architecture", "change_summary": "Sweep HIDDEN_DIMS: testing [64, 32] against current [256, 128, 64]", "files_changed": ["train.py"], "metric_name": "val_gini", "metric_value": 0.246285, "metric_direction": "maximize", "secondary_metrics": {"training_seconds": 60.6, "total_seconds": 60.9, "peak_memory_mb": 492.3, "num_steps": 40033.0, "num_params": 15873.0, "device": "mps", "device_name": "Apple M2"}, "status": "discard", "reasoning": "", "parent_experiment": 0, "platform_device": "mps", "platform_name": "Apple M2", "mutation_key": "param:HIDDEN_DIMS=[64, 32]"}
{"experiment_id": 24, "timestamp": "2026-03-14T01:56:57Z", "commit": "7ab3b99", "hypothesis": "HIDDEN_DIMS = [128, 64] (was [256, 128, 64])", "category": "architecture", "change_summary": "Sweep HIDDEN_DIMS: testing [128, 64] against current [256, 128, 64]", "files_changed": ["train.py"], "metric_name": "val_gini", "metric_value": 0.251529, "metric_direction": "maximize", "secondary_metrics": {"training_seconds": 60.0, "total_seconds": 60.3, "peak_memory_mb": 492.8, "num_steps": 38171.0, "num_params": 35841.0, "device": "mps", "device_name": "Apple M2"}, "status": "discard", "reasoning": "", "parent_experiment": 0, "platform_device": "mps", "platform_name": "Apple M2", "mutation_key": "param:HIDDEN_DIMS=[128, 64]"}
{"experiment_id": 25, "timestamp": "2026-03-14T01:58:00Z", "commit": "5e038b6", "hypothesis": "HIDDEN_DIMS = [256, 128] (was [256, 128, 64])", "category": "architecture", "change_summary": "Sweep HIDDEN_DIMS: testing [256, 128] against current [256, 128, 64]", "files_changed": ["train.py"], "metric_name": "val_gini", "metric_value": 0.242777, "metric_direction": "maximize", "secondary_metrics": {"training_seconds": 60.3, "total_seconds": 60.4, "peak_memory_mb": 493.8, "num_steps": 36309.0, "num_params": 88065.0, "device": "mps", "device_name": "Apple M2"}, "status": "discard", "reasoning": "", "parent_experiment": 0, "platform_device": "mps", "platform_name": "Apple M2", "mutation_key": "param:HIDDEN_DIMS=[256, 128]"}
{"experiment_id": 26, "timestamp": "2026-03-14T02:02:38Z", "commit": "2d56934", "hypothesis": "HIDDEN_DIMS = [512, 256, 128] (was [256, 128, 64])", "category": "architecture", "change_summary": "Sweep HIDDEN_DIMS: testing [512, 256, 128] against current [256, 128, 64]", "files_changed": ["train.py"], "metric_name": "val_gini", "metric_value": 0.274304, "metric_direction": "maximize", "secondary_metrics": {"training_seconds": 61.5, "total_seconds": 61.6, "peak_memory_mb": 497.3, "num_steps": 27930.0, "num_params": 274433.0, "device": "mps", "device_name": "Apple M2"}, "status": "discard", "reasoning": "", "parent_experiment": 0, "platform_device": "mps", "platform_name": "Apple M2", "mutation_key": "param:HIDDEN_DIMS=[512, 256, 128]"}
{"experiment_id": 27, "timestamp": "2026-03-14T02:03:42Z", "commit": "1b8f04f", "hypothesis": "HIDDEN_DIMS = [128, 128] (was [256, 128, 64])", "category": "architecture", "change_summary": "Sweep HIDDEN_DIMS: testing [128, 128] against current [256, 128, 64]", "files_changed": ["train.py"], "metric_name": "val_gini", "metric_value": 0.246724, "metric_direction": "maximize", "secondary_metrics": {"training_seconds": 61.0, "total_seconds": 61.1, "peak_memory_mb": 493.2, "num_steps": 38171.0, "num_params": 44161.0, "device": "mps", "device_name": "Apple M2"}, "status": "discard", "reasoning": "", "parent_experiment": 0, "platform_device": "mps", "platform_name": "Apple M2", "mutation_key": "param:HIDDEN_DIMS=[128, 128]"}
{"experiment_id": 28, "timestamp": "2026-03-14T02:04:45Z", "commit": "79fcdd7", "hypothesis": "HIDDEN_DIMS = [256, 256] (was [256, 128, 64])", "category": "architecture", "change_summary": "Sweep HIDDEN_DIMS: testing [256, 256] against current [256, 128, 64]", "files_changed": ["train.py"], "metric_name": "val_gini", "metric_value": 0.249037, "metric_direction": "maximize", "secondary_metrics": {"training_seconds": 60.1, "total_seconds": 60.2, "peak_memory_mb": 494.7, "num_steps": 37240.0, "num_params": 121089.0, "device": "mps", "device_name": "Apple M2"}, "status": "discard", "reasoning": "", "parent_experiment": 0, "platform_device": "mps", "platform_name": "Apple M2", "mutation_key": "param:HIDDEN_DIMS=[256, 256]"}
{"experiment_id": 29, "timestamp": "2026-03-14T02:05:50Z", "commit": "703fda0", "hypothesis": "ACTIVATION = 'gelu' (was 'relu')", "category": "architecture", "change_summary": "Sweep ACTIVATION: testing 'gelu' against current 'relu'", "files_changed": ["train.py"], "metric_name": "val_gini", "metric_value": 0.094959, "metric_direction": "maximize", "secondary_metrics": {"training_seconds": 61.8, "total_seconds": 62.0, "peak_memory_mb": 494.3, "num_steps": 28861.0, "num_params": 96257.0, "device": "mps", "device_name": "Apple M2"}, "status": "discard", "reasoning": "", "parent_experiment": 0, "platform_device": "mps", "platform_name": "Apple M2", "mutation_key": "param:ACTIVATION='gelu'"}
{"experiment_id": 30, "timestamp": "2026-03-14T02:06:55Z", "commit": "1d90391", "hypothesis": "ACTIVATION = 'silu' (was 'relu')", "category": "architecture", "change_summary": "Sweep ACTIVATION: testing 'silu' against current 'relu'", "files_changed": ["train.py"], "metric_name": "val_gini", "metric_value": 0.232422, "metric_direction": "maximize", "secondary_metrics": {"training_seconds": 61.8, "total_seconds": 61.8, "peak_memory_mb": 494.3, "num_steps": 28861.0, "num_params": 96257.0, "device": "mps", "device_name": "Apple M2"}, "status": "discard", "reasoning": "", "parent_experiment": 0, "platform_device": "mps", "platform_name": "Apple M2", "mutation_key": "param:ACTIVATION='silu'"}
{"experiment_id": 31, "timestamp": "2026-03-14T02:07:59Z", "commit": "d3698d1", "hypothesis": "ACTIVATION = 'tanh' (was 'relu')", "category": "architecture", "change_summary": "Sweep ACTIVATION: testing 'tanh' against current 'relu'", "files_changed": ["train.py"], "metric_name": "val_gini", "metric_value": 0.211073, "metric_direction": "maximize", "secondary_metrics": {"training_seconds": 60.4, "total_seconds": 60.5, "peak_memory_mb": 494.1, "num_steps": 26999.0, "num_params": 96257.0, "device": "mps", "device_name": "Apple M2"}, "status": "discard", "reasoning": "", "parent_experiment": 0, "platform_device": "mps", "platform_name": "Apple M2", "mutation_key": "param:ACTIVATION='tanh'"}
{"experiment_id": 32, "timestamp": "2026-03-14T02:09:03Z", "commit": "96edd44", "hypothesis": "Switch to AdamW", "category": "optimizer", "change_summary": "Decoupled weight decay, often better generalization", "files_changed": ["train.py"], "metric_name": "val_gini", "metric_value": 0.002066, "metric_direction": "maximize", "secondary_metrics": {"training_seconds": 60.8, "total_seconds": 60.9, "peak_memory_mb": 494.1, "num_steps": 27930.0, "num_params": 96257.0, "device": "mps", "device_name": "Apple M2"}, "status": "discard", "reasoning": "", "parent_experiment": 0, "platform_device": "mps", "platform_name": "Apple M2", "mutation_key": "swap:Switch to AdamW"}
