{"experiment_id": 33, "timestamp": "2026-03-14T02:10:06Z", "commit": "dd01566", "hypothesis": "Add cosine annealing LR scheduler", "category": "optimizer", "change_summary": "Smooth LR decay often improves final convergence", "files_changed": ["train.py"], "metric_name": "val_gini", "metric_value": 0.243823, "metric_direction": "maximize", "secondary_metrics": {"training_seconds": 60.4, "total_seconds": 60.5, "peak_memory_mb": 494.1, "num_steps": 27930.0, "num_params": 96257.0, "device": "mps", "device_name": "Apple M2"}, "status": "discard", "reasoning": "", "parent_experiment": 0, "platform_device": "mps", "platform_name": "Apple M2", "mutation_key": "insert:Add cosine annealing LR scheduler"}
